PR番号,タイトル,作成者,作成日,ステータス,政策分野（新ラベル）,旧ラベル,分類理由,分析メモ,URL,説明（200文字まで）
6006,【いのりさん提案】相続手続きのデジタル化による負担軽減,app/idobata-policy-app,2025-07-13T04:17:56Z,OPEN,その他政策,README,「親子断絶防止法」による共同親権の推進,自動分類: 2025-07-14,https://github.com/team-mirai/policy/pull/6006,【いのりさん提案】相続手続きのデジタル化による負担軽減
6001,DAOの社会実装による、公正で柔軟な働き方の実現,app/idobata-policy-app,2025-07-13T03:57:56Z,OPEN,福祉,README,「困っている人」への包括的支援システム,自動分類: 2025-07-14,https://github.com/team-mirai/policy/pull/6001,DAOの社会実装による、公正で柔軟な働き方の実現
5999,「プラネタリーヘルス」に関する政策検討の表現を修正,app/idobata-policy-app,2025-07-13T03:51:12Z,OPEN,産業政策,README,プラネタリーヘルス（予防医療・サステナブル産業・AI技術の統合）への投資に関する提案,自動分類: 2025-07-14,https://github.com/team-mirai/policy/pull/5999,「プラネタリーヘルス」に関する政策検討の表現を修正
5996,AIと著作権に関する基本方針を追記,app/idobata-policy-app,2025-07-13T03:37:53Z,OPEN,その他政策,README,AIと著作権に関する基本方針。知的財産権保護に関する政策,自動分類: 2025-07-14,https://github.com/team-mirai/policy/pull/5996,AIと著作権に関する基本方針を追記
5995,マニフェストへの選択的夫婦別姓に関する記述の追加,app/idobata-policy-app,2025-07-13T03:36:46Z,OPEN,ビジョン,README,選択的夫婦別姓と同性婚に関する基本理念の追加,自動分類: 2025-07-14,https://github.com/team-mirai/policy/pull/5995,マニフェストへの選択的夫婦別姓に関する記述の追加
5994,バグ報告：iOS版ブラウザでハンバーガーメニューの項目が選択できない,app/idobata-policy-app,2025-07-13T03:31:01Z,OPEN,['システム'],README,iOS版ブラウザのバグ報告。技術的な問題のドキュメント化,自動分類: 2025-07-14,https://github.com/team-mirai/policy/pull/5994,バグ報告：iOS版ブラウザでハンバーガーメニューの項目が選択できない
5992,【政策提案】誰もが安心して使える「ワークスペース環境」の整備,app/idobata-policy-app,2025-07-13T03:17:43Z,OPEN,その他政策,README,公共ワークスペース環境の整備。都市インフラ・公共施設活用,自動分類: 2025-07-14,https://github.com/team-mirai/policy/pull/5992,【政策提案】誰もが安心して使える「ワークスペース環境」の整備
5988,AI等デジタル技術の調達・運用に関する原則の追記,app/idobata-policy-app,2025-07-13T02:58:33Z,OPEN,行政改革,README,AI等デジタル技術の調達・運用における透明性とセキュリティ確保,自動分類: 2025-07-14,https://github.com/team-mirai/policy/pull/5988,AI等デジタル技術の調達・運用に関する原則の追記
5983,0289さんによる提案：ステップ1への「ネット広告の健全化」の追加,app/idobata-policy-app,2025-07-13T02:42:45Z,OPEN,その他政策,README,ネット広告の健全化。インターネット規制・消費者保護,自動分類: 2025-07-14,https://github.com/team-mirai/policy/pull/5983,0289さんによる提案：ステップ1への「ネット広告の健全化」の追加
5982,AI・デジタル原則の明確化と、制度の谷間にいる方への配慮を追加,app/idobata-policy-app,2025-07-13T02:41:00Z,OPEN,ビジョン,README,AI活用の責任原則とデジタル化における配慮の基本方針,自動分類: 2025-07-14,https://github.com/team-mirai/policy/pull/5982,AI・デジタル原則の明確化と、制度の谷間にいる方への配慮を追加
5981,政策項目「福祉」に、制度の狭間にある人々への支援についての補足を追記,app/idobata-policy-app,2025-07-13T02:38:31Z,OPEN,その他政策,README,年金制度の公平性確保と世代間格差の是正,自動分類: 2025-07-14,https://github.com/team-mirai/policy/pull/5981,政策項目「福祉」に、制度の狭間にある人々への支援についての補足を追記
5980,匿名ユーザーによる包括的性教育と多様な家族のあり方に関する改善提案,app/idobata-policy-app,2025-07-13T02:37:38Z,OPEN,エネルギー,README,原子力発電のあり方に関する基本方針,自動分類: 2025-07-14,https://github.com/team-mirai/policy/pull/5980,匿名ユーザーによる包括的性教育と多様な家族のあり方に関する改善提案
5977,経済的に困難な若者のための就労・自立支援制度の創設,app/idobata-policy-app,2025-07-13T02:31:05Z,OPEN,その他政策,README,死刑制度廃止と終身刑導入に関する提案,自動分類: 2025-07-14,https://github.com/team-mirai/policy/pull/5977,経済的に困難な若者のための就労・自立支援制度の創設
5972,生活保護制度の見直しと不正受給対策の強化,app/idobata-policy-app,2025-07-13T01:57:11Z,OPEN,行政改革,README,地方自治体の行政サービス統一化とデジタル化,自動分類: 2025-07-14,https://github.com/team-mirai/policy/pull/5972,生活保護制度の見直しと不正受給対策の強化
5971,【匿名ユーザーからの改善提案】人権に関する基本方針の追加,app/idobata-policy-app,2025-07-13T01:54:54Z,OPEN,産業政策,README,一次産業（農林水産業）の未来に関する政策提案,自動分類: 2025-07-14,https://github.com/team-mirai/policy/pull/5971,【匿名ユーザーからの改善提案】人権に関する基本方針の追加
5963,目次を更新：デジタル民主主義の項目に政治資金の透明化と罰則強化を追記,app/idobata-policy-app,2025-07-13T01:31:31Z,OPEN,エネルギー,README,太陽光発電と電気自動車を活用した災害対策とエネルギー政策,自動分類: 2025-07-14,https://github.com/team-mirai/policy/pull/5963,目次を更新：デジタル民主主義の項目に政治資金の透明化と罰則強化を追記
5959,子育て支援策に関する公平性の議論の追加,app/idobata-policy-app,2025-07-13T01:15:02Z,OPEN,その他政策,README,政治家の議論スキル向上と記録公開に関する提案,自動分類: 2025-07-14,https://github.com/team-mirai/policy/pull/5959,子育て支援策に関する公平性の議論の追加
5958,インボイス制度の廃止と消費税の単一税率化提案,app/idobata-policy-app,2025-07-13T01:14:23Z,OPEN,教育,README,学校給食費の無償化と子どもの食の安全,自動分類: 2025-07-14,https://github.com/team-mirai/policy/pull/5958,インボイス制度の廃止と消費税の単一税率化提案
5957,子育て支援の拡充：企業内保育の促進,app/idobata-policy-app,2025-07-13T01:09:40Z,OPEN,その他政策,README,生成AIと著作権に関する法的ルールの明確化,自動分類: 2025-07-14,https://github.com/team-mirai/policy/pull/5957,子育て支援の拡充：企業内保育の促進
5956,政策評価の基本方針に多角的視点を追加,app/idobata-policy-app,2025-07-13T01:00:51Z,OPEN,['システム'],README,マニフェストのタイポ修正,自動分類: 2025-07-14,https://github.com/team-mirai/policy/pull/5956,政策評価の基本方針に多角的視点を追加
5952,マニフェスト改善提案：大学などの高等教育における経済的負担の軽減を明確化,app/idobata-policy-app,2025-07-13T00:47:55Z,OPEN,その他政策,README,過疎地域の活性化と持続可能な地域づくり,自動分類: 2025-07-14,https://github.com/team-mirai/policy/pull/5952,マニフェスト改善提案：大学などの高等教育における経済的負担の軽減を明確化
5950,「分断をあおらない」理念の構造的課題についての言及を追加,app/idobata-policy-app,2025-07-13T00:43:54Z,OPEN,その他政策,README,防災対策としての電柱地中化推進,自動分類: 2025-07-14,https://github.com/team-mirai/policy/pull/5950,「分断をあおらない」理念の構造的課題についての言及を追加
5943,【重要課題の明記】党の基本方針の不在について,app/idobata-policy-app,2025-07-13T00:17:20Z,OPEN,福祉,README,養護施設出身者への社会的支援強化,自動分類: 2025-07-14,https://github.com/team-mirai/policy/pull/5943,【重要課題の明記】党の基本方針の不在について
5940,【うしさん提案】子育て政策の改善：学童保育の環境を充実に,app/idobata-policy-app,2025-07-13T00:08:47Z,OPEN,産業政策,README,一次産業（農林水産業）の振興と地方活性化,自動分類: 2025-07-14,https://github.com/team-mirai/policy/pull/5940,【うしさん提案】子育て政策の改善：学童保育の環境を充実に
5939,【ふるちゃんさん提案】国際卓越研究大学を中心とした共同研究体制の推進,app/idobata-policy-app,2025-07-13T00:06:52Z,OPEN,その他政策,README,女性と女児への差別撤廃と権利保障,自動分類: 2025-07-14,https://github.com/team-mirai/policy/pull/5939,【ふるちゃんさん提案】国際卓越研究大学を中心とした共同研究体制の推進
5938,「誰一人取り残さない防災DX」の実現に向けた新規政策提案,app/idobata-policy-app,2025-07-13T00:05:50Z,OPEN,その他政策,README,政治家の報酬と定年制に関する提案,自動分類: 2025-07-14,https://github.com/team-mirai/policy/pull/5938,「誰一人取り残さない防災DX」の実現に向けた新規政策提案
5933,選択的夫婦別姓に関する方針を追加,app/idobata-policy-app,2025-07-12T23:48:28Z,OPEN,その他政策,README,外国人参政権と移民政策に関する提案,自動分類: 2025-07-14,https://github.com/team-mirai/policy/pull/5933,選択的夫婦別姓に関する方針を追加
5932,マニフェストの基本原則としての人権尊重の姿勢を明記,app/idobata-policy-app,2025-07-12T23:43:19Z,OPEN,その他政策,README,動物愛護と殺処分ゼロに関する政策,自動分類: 2025-07-14,https://github.com/team-mirai/policy/pull/5932,マニフェストの基本原則としての人権尊重の姿勢を明記
5930,高等学校等就学支援金制度の見直し,app/idobata-policy-app,2025-07-12T23:31:33Z,OPEN,その他政策,README,高齢者運転免許返納支援と公共交通の充実,自動分類: 2025-07-14,https://github.com/team-mirai/policy/pull/5930,高等学校等就学支援金制度の見直し
5928,選択的夫婦別姓制度の導入を提案,app/idobata-policy-app,2025-07-12T23:28:31Z,OPEN,その他政策,README,官僚制度改革と行政の効率化,自動分類: 2025-07-14,https://github.com/team-mirai/policy/pull/5928,選択的夫婦別姓制度の導入を提案
5924,ベルマーク制度の廃止と代替案の提案,app/idobata-policy-app,2025-07-12T22:56:50Z,OPEN,['システム'],README,メールアドレスのタイポ修正（Gmail関連）,自動分類: 2025-07-14,https://github.com/team-mirai/policy/pull/5924,ベルマーク制度の廃止と代替案の提案
5919,テクノロジーが苦手な方へのアプローチに関する追記,app/idobata-policy-app,2025-07-12T22:27:59Z,OPEN,医療,README,健康診断結果のデジタル化と一元管理,自動分類: 2025-07-14,https://github.com/team-mirai/policy/pull/5919,テクノロジーが苦手な方へのアプローチに関する追記
5910,meumoさん提案：葉酸に関する検討プロセスの追記,app/idobata-policy-app,2025-07-12T19:40:08Z,OPEN,福祉,README,高齢者のデジタルディバイド解消支援,自動分類: 2025-07-14,https://github.com/team-mirai/policy/pull/5910,meumoさん提案：葉酸に関する検討プロセスの追記
5903,社会保険料と税金の使途に関する議論の明記,app/idobata-policy-app,2025-07-12T18:12:11Z,OPEN,その他政策,README,政治資金の透明化と企業献金規制,自動分類: 2025-07-14,https://github.com/team-mirai/policy/pull/5903,社会保険料と税金の使途に関する議論の明記
5896,多様な世帯への配慮と地方創生の視点を追加する提案 by こんごう,app/idobata-policy-app,2025-07-12T17:00:17Z,OPEN,子育て,README,不妊治療支援の拡充と少子化対策,自動分類: 2025-07-14,https://github.com/team-mirai/policy/pull/5896,多様な世帯への配慮と地方創生の視点を追加する提案 by こんごう
5893,fさんによる「地方のデジタル産業振興」の追加提案,app/idobata-policy-app,2025-07-12T16:54:11Z,OPEN,教育,README,教育現場でのICT活用とプログラミング教育,自動分類: 2025-07-14,https://github.com/team-mirai/policy/pull/5893,fさんによる「地方のデジタル産業振興」の追加提案
5892,マニフェストに「議員の定年制導入」に関する項目を追加,app/idobata-policy-app,2025-07-12T16:42:27Z,OPEN,その他政策,README,投票権年齢の引き下げと若者の政治参加促進,自動分類: 2025-07-14,https://github.com/team-mirai/policy/pull/5892,マニフェストに「議員の定年制導入」に関する項目を追加
5887,「表現の自由」に関する方針を追加,app/idobata-policy-app,2025-07-12T16:38:17Z,OPEN,経済財政,README,地方税制改革と財源の地方移譲,自動分類: 2025-07-14,https://github.com/team-mirai/policy/pull/5887,「表現の自由」に関する方針を追加
5882,匿名ユーザーによる提案：現場負担への配慮とAI時代の人材活用策の追加,app/idobata-policy-app,2025-07-12T16:18:26Z,OPEN,その他政策,README,司法制度改革と裁判の迅速化,自動分類: 2025-07-14,https://github.com/team-mirai/policy/pull/5882,匿名ユーザーによる提案：現場負担への配慮とAI時代の人材活用策の追加
5881,はるさんによるマニフェスト改善提案,app/idobata-policy-app,2025-07-12T16:12:48Z,OPEN,福祉,README,障害者の就労支援と社会参加促進,自動分類: 2025-07-14,https://github.com/team-mirai/policy/pull/5881,はるさんによるマニフェスト改善提案
5874,なちさんより：マニフェストの信頼性向上のための3つの提案,app/idobata-policy-app,2025-07-12T15:37:01Z,OPEN,その他政策,README,公文書管理の徹底と情報公開の推進,自動分類: 2025-07-14,https://github.com/team-mirai/policy/pull/5874,なちさんより：マニフェストの信頼性向上のための3つの提案
5873,「世代による一票の価値の違い」に関する議論の提起,app/idobata-policy-app,2025-07-12T15:34:38Z,OPEN,産業政策,README,中小企業支援とスタートアップ育成,自動分類: 2025-07-14,https://github.com/team-mirai/policy/pull/5873,「世代による一票の価値の違い」に関する議論の提起
5869,選挙運動のデジタル化と静穏化に関する提案,app/idobata-policy-app,2025-07-12T15:26:18Z,OPEN,その他政策,README,地方分権の推進と道州制導入,自動分類: 2025-07-14,https://github.com/team-mirai/policy/pull/5869,選挙運動のデジタル化と静穏化に関する提案
5868,冒頭文を修正し、マニフェストが目指す方向性をより明確化,app/idobata-policy-app,2025-07-12T15:25:29Z,OPEN,教育,README,大学教育改革と研究環境の改善,自動分類: 2025-07-14,https://github.com/team-mirai/policy/pull/5868,冒頭文を修正し、マニフェストが目指す方向性をより明確化
5858,keiphotoさんによる提案：結婚の有無にかかわらず子どもを産み育てやすい社会の実現,app/idobata-policy-app,2025-07-12T15:01:36Z,OPEN,その他政策,README,選挙制度改革と一票の格差是正,自動分類: 2025-07-14,https://github.com/team-mirai/policy/pull/5858,keiphotoさんによる提案：結婚の有無にかかわらず子どもを産み育てやすい社会の実現
5846,【.34さん提案】災害時の非常用通信ネットワーク構築について,app/idobata-policy-app,2025-07-12T14:36:11Z,OPEN,エネルギー,README,再生可能エネルギーの普及促進,自動分類: 2025-07-14,https://github.com/team-mirai/policy/pull/5846,【.34さん提案】災害時の非常用通信ネットワーク構築について
5840,ひらりさんからの提案：選択的夫婦別姓の実現,app/idobata-policy-app,2025-07-12T14:19:55Z,OPEN,医療,README,遠隔医療の推進と医療アクセスの改善,自動分類: 2025-07-14,https://github.com/team-mirai/policy/pull/5840,ひらりさんからの提案：選択的夫婦別姓の実現
5839,選択的夫婦別姓制度の実現に関する項目を追加,app/idobata-policy-app,2025-07-12T14:16:58Z,OPEN,その他政策,README,外交政策と国際協力の強化,自動分類: 2025-07-14,https://github.com/team-mirai/policy/pull/5839,選択的夫婦別姓制度の実現に関する項目を追加
5834,外交政策の項目を見直し、日本の自律性強化に関する議論を提案,app/idobata-policy-app,2025-07-12T14:07:34Z,OPEN,福祉,README,介護職員の待遇改善と人材確保,自動分類: 2025-07-14,https://github.com/team-mirai/policy/pull/5834,外交政策の項目を見直し、日本の自律性強化に関する議論を提案
5833,国の主権と国益を守る姿勢の明確化,app/idobata-policy-app,2025-07-12T14:06:49Z,OPEN,子育て,README,保育園待機児童問題の解消,自動分類: 2025-07-14,https://github.com/team-mirai/policy/pull/5833,国の主権と国益を守る姿勢の明確化
5832,性犯罪対策の抜本的強化,app/idobata-policy-app,2025-07-12T14:06:40Z,OPEN,その他政策,README,防犯対策と治安維持の強化,自動分類: 2025-07-14,https://github.com/team-mirai/policy/pull/5832,性犯罪対策の抜本的強化
5830,匿名ユーザーからの提案：認定柔道整復師による予防医療の推進,app/idobata-policy-app,2025-07-12T14:01:12Z,OPEN,産業政策,README,観光産業の振興と地域活性化,自動分類: 2025-07-14,https://github.com/team-mirai/policy/pull/5830,匿名ユーザーからの提案：認定柔道整復師による予防医療の推進
5822,福祉分野の政策に、性犯罪の根絶を目指す新たな項目を追加,app/idobata-policy-app,2025-07-12T13:39:15Z,OPEN,その他政策,README,性犯罪の根絶に関する司法・治安政策,自動分類: 2025-07-14,https://github.com/team-mirai/policy/pull/5822,福祉分野の政策に、性犯罪の根絶を目指す新たな項目を追加
5817,提案：デジタル民主主義に「世代間の声の不均衡を是正する仕組み」を追加,app/idobata-policy-app,2025-07-12T13:24:58Z,OPEN,デジタル民主主義,README,世代間の声の不均衡を是正する民主主義の仕組み,自動分類: 2025-07-14,https://github.com/team-mirai/policy/pull/5817,提案：デジタル民主主義に「世代間の声の不均衡を是正する仕組み」を追加
5816,改善提案：子どもの安全を守るための新しい政策項目を追加,app/idobata-policy-app,2025-07-12T13:24:36Z,OPEN,子育て,README,子どもの安全を守るための政策,自動分類: 2025-07-14,https://github.com/team-mirai/policy/pull/5816,改善提案：子どもの安全を守るための新しい政策項目を追加
5813,性犯罪・性暴力の根絶と被害者保護の徹底を求める提案,app/idobata-policy-app,2025-07-12T13:13:14Z,OPEN,その他政策,README,性犯罪・性暴力の根絶と被害者保護（司法・治安）,自動分類: 2025-07-14,https://github.com/team-mirai/policy/pull/5813,性犯罪・性暴力の根絶と被害者保護の徹底を求める提案
5799,支援のあり方に関する基本原則の追加,app/idobata-policy-app,2025-07-12T12:24:15Z,OPEN,ビジョン,README,支援のあり方に関する基本原則の追加,自動分類: 2025-07-14,https://github.com/team-mirai/policy/pull/5799,支援のあり方に関する基本原則の追加
5798,すぎやまさんによる「コンテンツ産業と表現の自由」に関する改善提案,app/idobata-policy-app,2025-07-12T12:22:40Z,OPEN,その他政策,README,コンテンツ産業と表現の自由に関する政策,自動分類: 2025-07-14,https://github.com/team-mirai/policy/pull/5798,すぎやまさんによる「コンテンツ産業と表現の自由」に関する改善提案
5797,国民の安全を守るための性犯罪対策強化,app/idobata-policy-app,2025-07-12T12:22:23Z,OPEN,その他政策,README,性犯罪対策強化（司法・治安）,自動分類: 2025-07-14,https://github.com/team-mirai/policy/pull/5797,国民の安全を守るための性犯罪対策強化
5796,政策提案：老老介護におけるコミュニケーション支援の具体例を追記,app/idobata-policy-app,2025-07-12T12:20:12Z,OPEN,福祉,README,老老介護におけるコミュニケーション支援,自動分類: 2025-07-14,https://github.com/team-mirai/policy/pull/5796,政策提案：老老介護におけるコミュニケーション支援の具体例を追記
5793,国民との対話の改革案：提案対応の遅延に対するお詫びと具体的な改善策の明記,app/idobata-policy-app,2025-07-12T12:14:39Z,OPEN,デジタル民主主義,README,国民との対話の改革と透明性向上,自動分類: 2025-07-14,https://github.com/team-mirai/policy/pull/5793,国民との対話の改革案：提案対応の遅延に対するお詫びと具体的な改善策の明記
5785,「チームみらいについて」の記述を改善し、デジタル化への姿勢を明確化,app/idobata-policy-app,2025-07-12T11:56:44Z,OPEN,['システム'],README,「チームみらいについて」の記述改善,自動分類: 2025-07-14,https://github.com/team-mirai/policy/pull/5785,「チームみらいについて」の記述を改善し、デジタル化への姿勢を明確化
5774,【太一郎提案】提案への迅速な応答を義務付け、チームみらいの不誠実な対応を是正,app/idobata-policy-app,2025-07-12T10:54:35Z,OPEN,デジタル民主主義,README,提案への迅速な応答義務付け,自動分類: 2025-07-14,https://github.com/team-mirai/policy/pull/5774,【太一郎提案】提案への迅速な応答を義務付け、チームみらいの不誠実な対応を是正
5772,教育におけるデジタルと従来手法の最適な組み合わせを求める方針の追加,app/idobata-policy-app,2025-07-12T10:52:04Z,OPEN,教育,README,教育におけるデジタルと従来手法の組み合わせ,自動分類: 2025-07-14,https://github.com/team-mirai/policy/pull/5772,教育におけるデジタルと従来手法の最適な組み合わせを求める方針の追加
5771,【匿名ユーザーさんによる改善提案】国際宇宙港（スペースポート）構想の追加,app/idobata-policy-app,2025-07-12T10:51:09Z,OPEN,科学技術,README,国際宇宙港（スペースポート）構想,自動分類: 2025-07-14,https://github.com/team-mirai/policy/pull/5771,【匿名ユーザーさんによる改善提案】国際宇宙港（スペースポート）構想の追加
5770,政策提案：障害者支援における多角的な負担決定プロセスの導入,app/idobata-policy-app,2025-07-12T10:43:37Z,OPEN,福祉,README,障害者支援における負担決定プロセス,自動分類: 2025-07-14,https://github.com/team-mirai/policy/pull/5770,政策提案：障害者支援における多角的な負担決定プロセスの導入
5767,同性婚の法制化をマニフェストに明記する提案,app/idobata-policy-app,2025-07-12T10:25:50Z,OPEN,ビジョン,README,同性婚の法制化に関する基本方針,自動分類: 2025-07-14,https://github.com/team-mirai/policy/pull/5767,同性婚の法制化をマニフェストに明記する提案
5766,マニフェストの基本理念の明確化,app/idobata-policy-app,2025-07-12T10:13:39Z,OPEN,ビジョン,README,マニフェストの基本理念の明確化,自動分類: 2025-07-14,https://github.com/team-mirai/policy/pull/5766,マニフェストの基本理念の明確化
5763,政策の追加：同性婚の法制化,app/idobata-policy-app,2025-07-12T10:07:56Z,OPEN,ビジョン,README,同性婚の法制化に関する政策,自動分類: 2025-07-14,https://github.com/team-mirai/policy/pull/5763,政策の追加：同性婚の法制化
5762,公的な死後事務支援システムの構築に関する提案,app/idobata-policy-app,2025-07-12T10:03:43Z,OPEN,福祉,README,公的な死後事務支援システムの構築,自動分類: 2025-07-14,https://github.com/team-mirai/policy/pull/5762,公的な死後事務支援システムの構築に関する提案
5758,ケアマネジャー更新研修制度の負担軽減と抜本的見直し,app/idobata-policy-app,2025-07-12T09:43:28Z,OPEN,福祉,README,ケアマネジャー更新研修制度の見直し,自動分類: 2025-07-14,https://github.com/team-mirai/policy/pull/5758,ケアマネジャー更新研修制度の負担軽減と抜本的見直し
5756,いじめ・性加害の加害者に対する教育改革案の追加,app/idobata-policy-app,2025-07-12T09:30:38Z,OPEN,教育,README,いじめ・性加害の加害者に対する教育改革,自動分類: 2025-07-14,https://github.com/team-mirai/policy/pull/5756,いじめ・性加害の加害者に対する教育改革案の追加
